哪部電影不是由湯姆漢克主演？,神鬼交鋒,阿甘正傳,世紀交鋒,C
「流星花園」並未由哪個國家翻拍為電視劇？,韓國,緬甸,臺灣,B
奇皇后是描述高麗人變成中國哪代皇后的故事？,元,明,清,A
2014第72屆金球獎最佳動畫的得主是？,馴龍高手2,里約大冒險2,樂高玩電影,A
亞洲天王周杰倫第一步進軍好萊塢的電影是？,出神入化,出神入化2,青蜂俠,C
下列哪一部電影不是由真人真事改編？,127小時,模仿遊戲,決勝21點,C
李奧納多狄卡皮歐沒有演過下列哪一部作品？,華爾街之狼,隔離島,鐘點戰,C
歌手鄧麗君的本名？　,鄧麗均,鄧麗筠,鄧麗鈞,B
下列哪位歌手沒有「愛你」這首歌？,陳芳語,蔡依林,柯有倫,B
哪一位藝人到2015年才有自己正式的官方粉絲團？,林志玲,羅志祥,阿信,A
插畫家Cherng繪出哪種動物而紅遍大街小巷？,馬來貘,拉拉熊,廢物貓,A
高跟鞋是誰發明的？,路易十四,路易十六,路易十七,A
潮牌Stage是哪位藝人的品牌？,羅志祥,阿信,黃鴻升,A
網路名人蔡阿嘎的本名是？,蔡緯嘉,蔡韋嘉,蔡緯佳,A
下列何者是律師同時也是政論節目主持人？,謝震武,吳淡如,吳宗憲,A
下列何者不是從「我愛黑澀會」中出道的藝人？,黃喬歆,蔡黃汝,詹子晴,B
音樂術語Allegro與什麼有關？,強度,音高,速度,C
被譽稱交響樂之父和弦樂四重奏之父的音樂家？,韓德爾頌,海頓,孟德爾頌,B
馬勒未完成的交響曲是第幾號？,第八號交響曲,第九號交響曲,第十號交響曲,C
蔡依林的經典歌曲不包括？,美人計,野蠻遊戲,家後,C
天后蔡依林的「大藝術家」中共提及幾位藝術家？,4,5,6,B
動畫海賊王中，改造人佛朗基的能量來源為何？,牛奶,可樂,酒,B
下列何者不是「遊戲王」中的神之卡？,翼神龍,天空龍,青眼白龍,C
「進擊的巨人」中，主角的什麼人最先死於巨人之口？,父親,母親,妹妹,B
在「閃電霹靂車」中，主角是在哪一年出道？,2014,2015,2016,B
「火影忍者」中漩渦鳴人的老婆是？,小櫻,日向雛田,綱手,B
進擊的巨人中，艾連在訓練生中總排名第幾？,3,4,5,C
下列何者不是宮崎駿的作品？ ,龍貓,天空之城,地海戰記,C
韓國團體少女時代一開始共有幾人？　,7,8,9,C
「史努比」系列動畫中的史努比是一隻？,拉不拉多,米格魯,臘腸狗,B
遊戲王中，武藤遊戲的另一個靈魂叫什麼名字？,亞圖姆,亞圖拉,亞圖恩,A
卡通「遊戲王」中持有千年錫杖的的是誰？,貝卡斯,城之內,馬利克,C
漫畫「哆啦A夢」中，時光機位於大雄房間的何處？,衣櫃,抽屜,櫥櫃,B
請問「怪醫黑傑克」裡的主人翁，黑傑克的本名為？,間黑男,傑克,黑南,A
海賊王中，香吉士在成為海賊前的職業是？,廚師,小偷,間諜,A
海賊王中喬巴是甚麼動物？,鹿,狗,熊,A
蠟筆小新中小新妹妹野原向日葵名字是怎麼決定的？,算命,猜拳,射紙飛機比賽,C
「地球是很危險的」是出自哪部電影？,功夫,少林足球,功夫之王,B
下列何者不是金凱瑞主演？,王牌大律師,當我們混在一起,摩登大聖,B
電影行動代號：華爾奇麗亞中主角們是要推翻誰？,史達林,希特勒,戴高樂,B
TPA於哪年奪得英雄聯盟世界冠軍？,2012,2013,2014,A
下列何者耳機品牌源自德國？,Bose,Harman Kardon ,Sennheiser,C
烏克麗麗有幾條弦？,4,5,6,A
下列何者非日本品牌,鐵三角,Sony ,B&W,C
下列機械鍵盤軸何者聲音最大？,青,紅,銀,A
高解析度音樂的英文簡寫是？,Hi qual,Hi res ,Hi tech,B
哪個耳機廠牌的特色有「女毒」之稱？,Sony,鐵三角,Philips,B
宮崎駿哪部動畫的男主角是學小提琴的？,風起,來自紅花板,心之谷,C
動畫風之谷中那片被汙染的地稱為？,死海,腐海,蟲海,B
動畫天空之城中天空之城的名稱是？,拉普達,多魯美,薩奇亞,A
有「亞洲舞王」之稱的藝人是？,潘瑋柏,羅志祥,周湯豪,B
下列何者不是舞曲？,大藝術家,不解釋親吻,不具名的悲傷,C
標準鋼琴有幾個鍵？,61,88,104,B
樂理中D大調有幾個升記號？,1,2,3,B
Beats by dr dre被甚麼廠商收購？,Harman Kardon ,Htc ,Apple,C
哪個片商不是迪士尼的？,漫威,二十世紀福斯,華納兄弟,C
哪位AV女優有暗黑林志玲之稱？,上原亞衣,波多野結衣,三上悠亞,B
漫威電影宇宙的第一部主角是誰？,美國隊長,索爾,鋼鐵人,C
哪位導演使用過未來3D技術拍電影？,諾蘭,雷利史考特,李安,C
下列哪部電影是由荷馬史詩改編而來？,木馬屠城,300壯士,龐貝,A
哪部電影中沒有喪尸？,我是傳奇,明天過後,末日之戰,B
哪部電影是在描述華特迪士尼的故事？,大夢想家,大娛樂家,大尋寶家,A
海賊王中誰不曾當過七武海？,漢考克,鷹眼,黑鬍子,C
下列何者不屬於木管樂器？,小號,薩克斯風,豎笛,A
下列哪首進行曲觀眾會在演奏中跟著鼓掌？,國徽進行曲,拉德斯基進行曲,馬賽進行曲,B
下列哪部電影描述國父的故事？,行動代號：孫中山,讓子彈飛,十月圍城,C
甄子丹沒有參演哪部電影？,關雲長,霍元甲,錦衣衛,B
變身國王中國王沒有變成甚麼過？,烏龜,鯨魚,牛,C
海賊王中原三大將何者退出海軍？,赤犬,青雉,黃猿,B
下列何者不是音樂劇電影？,樂來樂愛你,大娛樂家,大夢想家,C
馮迪索沒有參演哪部電影？,限制級褓母,限制級戰警,玩命再劫,C
電影異星戰場主角是被傳送到甚麼星球？,水星 ,金星,火星,C
電影變形金剛中與月亮有關的是第幾級？,2,3,4,B
電影飢餓遊戲中最開始國家分成幾個區？,11,12,13,C
電影怒海劫中上船的劫匪有幾人？,3,4,5,A
連恩尼遜並未參演下列哪部電影,狙擊陌生人,百萬種硬的方式,真實的勇氣,C
鋼琴中的柔音踏板是三個踏板中的哪一個？,左,中,右,A
三角鋼琴又稱為什麼？,平臺式鋼琴,直立式鋼琴,開蓋式鋼琴,A
下列哪種標準薩克斯風的管身沒有彎曲？,Soprano ,Alto,Tenor,A
下列哪種薩克斯風的音高最高？,Soprano ,Alto,Tenor,A
下列哪個喇吧廠牌屬於中國？,JVC,JBL,Edifier,C
下列何者不是常見的耳機發聲原理？,動圈,動塊,動鐵,B
周杰倫買下哪支英雄聯盟戰隊？,FW,ahq,TPA,C
2017英雄聯盟總決賽中誰奪得世界冠軍？,SKT,SSG,RNG,B
下列電影何者是由小說改編？,美麗魔物,扭轉時光機,全民超人,A
下列哪部電影以戰爭為題材？,攻其不備,危機倒數,逆戰,B
「人生就像巧克力」出於哪部電影？,阿甘正傳,刺激1995,當幸福來敲門,A
香港電影圈又被稱為__好萊塢？,中國好萊塢,東方好萊塢,亞洲好萊塢,B
2010春晚誰憑藉魔術表演一砲而紅？,劉謙,秦鳴曉,楊杰,A
蠟筆小新家裡爆炸後搬到甚麼公寓？,胯下癢,胯下痛,胯下腫,B
陳奕迅畢業於哪所大學？,香港中文大學,美國長春藤大學,英國金斯頓大學,C
影星成龍最原始的本名是甚麼？,陳港生,陳港昇,陳港勝,A
香蕉哥哥準備要跟誰結婚了？,水蜜桃姊姊,草莓姊姊,葡萄姊姊,B
講述逃獄故事的電影是？,刺激1993,刺激1995,刺激1997,B
動畫小美人魚中他要用甚麼換人類的雙腳？,視力,記憶,聲音,C
異形系列哪部導演是雷利史考特？,第一集,第二集,第三集,A
香港四大天王不包括誰？,張學友,黎明,陳奕迅,C
周潤發的出生地是？,北京,廣東,山東,B
電影神鬼交鋒中主角是甚麼類型的罪犯？,殺人,金融,偷竊,B
勞勃狄尼洛沒有參演下列哪部電影？,高年級實習生,世紀交鋒,時空旅人之妻,C
下列何者不是諾蘭導演執導的電影？,超人：鋼鐵之軀,蝙蝠俠：黑暗騎士,正義聯盟,C
相聲瓦舍創辦人沒有誰？,宋少卿,馮翊綱,常寶華,C
鐵達尼號的導演是誰？,史蒂芬史匹柏,詹姆斯卡麥隆,大衛芬奇,B
好萊塢電影「我是誰」中擔任主角的華人是？,成龍,李連杰,甄子丹,A
好萊塢電影公司坐落於哪裡？,波士頓,洛杉磯,紐約,B
哈利波特系列電影總共有幾集？,6,7,8,C
哈利波特中哪個老師職位都做超不過一年？,魔藥學,奇獸飼育學,黑魔法防禦術,C
哪種鼓常見的形式是兩顆一組,非洲鼓,邦加鼓,太鼓,B
金鋼狼單手有幾隻爪子？,3,4,5,A
電影魔戒是由甚麼改編而來？,傳說,小說,歷史,B
電影國產凌凌漆中所謂「最強武器」的是？,要你命2000,要你命3000,要你命5000,B
讓子彈飛中張麻子的面具是幾筒？,一筒,三筒,九筒,C
讓子彈飛中馬邦德最開始的職業是甚麼？,縣長,師爺,麻匪,A
鐵三角耳機中哪個型號有「陌生人妻」之稱？,M50X,ck330,MSR7,C
黃曉明的出生地是？,北京,上海,山東,C
臥虎藏龍的導演是？,張藝謀,李安,吳宇森,B
哪部電影不是黑人主演？,衝出康普頓,月光下的藍色男孩,舞力重擊,C
電影麻雀變鳳凰中女主角原本的職業是？,舞者,妓女,無職業,B
電影紅翼行動中最後有幾人存活？,0,1,2,B
動畫尖叫旅社中旅社老闆是？,吸血鬼,木乃伊,狼人,A
愛麗絲夢遊仙境中邪惡皇后是撲克牌的甚麼花色,黑桃,紅心,梅花,B
宮崎駿哪部動畫中沒有魔法？,神隱少女,海潮之聲,霍爾的移動城堡,B
宮崎駿動畫紅豬中主角的職業是？,廚師,水手,飛行員,C
宮崎駿動畫魔法公主中女主角是被甚麼動物撫養長大？,豬,猿,狗,C
宮崎駿哪部動畫劇情是在搶救學校大樓？,來自紅花板,風起,心之谷,A
電影阿凡達的哈利路亞山勢在哪裡曲取景？,華山,九寨溝,張家界,C
笑傲江湖中令狐沖處於甚麼門脈？,武當派,華山派,嵩山派,B
鹿鼎記中韋小寶有幾個老婆？,7,8,9,A
金庸小說射鵰三部曲中沒有哪一部？,神雕俠侶,倚天屠龍記,天龍八部,C
天龍八部中段譽不會甚麼武功？,凌波微步,六脈神劍,降龍十八掌,C
金庸小說中九指神丐的名字是？,洪七公,洪八公,洪九公,A
金庸小說中九指神丐是斷哪一指？,食指,中指,無名指,A,,,,#
天龍八部中人稱「北喬峰，南__」？,慕蓉,歐陽,皇甫,A
射鵰英雄傳中南帝的武功是甚麼？,彈指神通,一陽指,蛤蟆功,B
射鵰英雄傳中黃藥師的武功不包括？,彈指神通,桃華落英掌,空明拳,C
射鵰英雄傳中有「老頑童」之稱的是？,歐陽鋒,王陽明,周伯通,C
「笑傲江湖」一詞的由來是？,武功秘笈名,武器名,曲名,C
笑傲江湖中東方不敗使用的武器是？,劍,針,鞭,B
射鵰英雄傳中的江南七怪誰是瞎子？,柯震惡,韓寶駒,朱聰,A
射鵰英雄傳中江南七怪誰死的最早？,南希仁,張阿生,全金發,B
射鵰英雄傳中丘處機屬於甚麼門派？,少林派,武當派,全真派,C
五嶽中不包括甚麼山？,黃山,華山,恆山,A
神雕俠侶中楊過稱小龍女為？,姊姊,師父,姑姑,C
神鵰俠侶中小龍女在絕情谷底時將訊息刻在甚麼昆蟲翅膀上？,蝴蝶,蜜蜂,蜻蜓,B
射鵰英雄傳中周伯通與誰偷情？,瑛姑,梅超風,韓小瑩,A
金庸小說中哪部武功秘笈不要求「自宮」？,葵花寶典,九陰真經,辟邪劍譜,B
倚天屠龍記中明教四大法王誰是女的？,紫杉龍王,青翼蝠王,白眉鷹王,A
笑傲江湖中令狐沖的武功不包括？,吸星大法,獨孤劍法,辟邪劍法,C
笑傲江湖中誰沒教過令狐沖武功？,獨孤求敗,風清揚,岳不群,A
笑傲江湖中岳不群被人稱為？,奪命劍,書生劍,君子劍,C
王昌齡〈出塞〉詩中「但使龍城飛將在，不教胡馬度__」？,陰山,邊關,燕山,A
天龍八部中喬峰本名？,謝峰,徐峰,蕭峰,C
「紅杏出牆」一詞源於葉紹翁的？,遊園不值,春望,春葉喜雨,A
「海內存知己，天涯若比鄰」是誰的詩？,王維,李白,王勃,C
正氣歌「人生自古誰無死，留取丹心照__」？,漢青,汗青,汗清,B
誰七步成詩？,曹丕,曹植,曹操,B
「野火燒不盡，春風吹又生」是誰的詩？,白居易,王維,杜牧,A
「三十功名塵與土，八千里路雲和月」是誰的詞句？,岳飛,辛棄疾,文天祥,A
「春蠶到死絲方盡，蠟炬成灰淚始乾」是誰的詩？,李賀,李清照,李商隱,C
誰有詩佛之稱？,李白,王維,白居易,B
誰有詩鬼之稱？,王維,李賀,孟郊,B
誰不在京劇四大名旦之列？,梅蘭芳,王惠芳,程硯秋,B
京劇四大行當中哪個最自由？,生,淨,丑,C
「格列佛遊記」是哪國作家的作品？,法國,丹麥,英國,C
「鐘樓怪人」的名字是？,加斯頓,加西莫多,加美拉,B
何者不是三國演義中的故事？,三打祝家莊,六出祈山,九發中原,A
下列何者不是水滸傳中的女將？,顧大嫂,林二娘,扈三娘,B
西遊記中沙僧最後被封為？,金身羅漢,鬥戰勝佛,淨壇使者,A
紅樓夢中以潑辣文明，精明能幹的實際大管家是誰？,史湘雲,王熙鳳,薛寶釵,B
紅樓夢中賈寶玉為了哄誰開心而撕扇子？,林黛玉,晴雯,襲人,B
紅樓夢中誰有金鎖片？,林黛玉,薛寶釵,賈元春],B
紅樓夢中賈寶玉他們所組的詩社名為？,牡丹詩社,西瀛詩社,海棠詩社,C
魯迅又名？,周建人,周敦人,周樹人,C
西遊記的作者是？,吳承恩,羅貫中,施耐庵,A
大文豪雨果是哪裡人？,德國,英國,法國,C
成語「破釜沉舟」源於哪一場戰爭？,鉅鹿之戰,赤壁之戰,長平之戰,A
何者不是中國四大名著？,水滸傳,紅樓夢,西遊記,B
下列何者不是晚清四大譴責小說之一？,孽海花,儒林外史,老殘遊記,B
西遊記中的「火焰山」是現在的哪裡？,吐魯番窪地,四川盆地,塔里木盆地,A
「女媧補天」神話出於？,說苑,呂氏春秋,山海經,C
阿拉伯民間故事「一千零一夜」又稱？,十日談,神曲,天方夜譚,C
「小說」之名始見於？,論語,莊子,孟子,B
香港科幻小說代表作家是？,張小嫻,倪匡,高陽,B
一直稱自己是「鄉下人」的作家是？,趙樹理,沈從文,柳青,B
何者為中國第一部語錄體散文？,詩經,國語,論語,C
下列何者不是朱自清的作品？,故都的秋,荷塘月色,春,A
水滸傳中梁山好漢的領袖是？,宋江,盧俊義,吳用,A
水滸傳中人稱黑旋風的是誰？,阮小二,秦明,李逵,C
哪部小說沒有「五虎將」？,三國演義,西遊記,水滸傳,B
誰不在水滸傳五虎將之內？,林沖,張順,董平,B
誰是水滸傳裡的「智多星」？,吳用,晁蓋,公孫勝,A
水滸傳裡外號「打虎將」的人是誰？,林沖,李忠,呼延灼,B
水滸傳的背景是哪個朝代？,宋,元,明,A
水滸傳中的阮家三雄沒有誰？,阮小二,阮小四,阮小七,B
拒絕接受美援的是哪位文人？,朱自清,老舍,郭沫若,A
「民為貴，社稷次之，君為輕」出自何處？,論語,孟子,墨子,B
奧地利作家茨威格筆下「世間最美的墳墓」的主人是誰？,巴爾札克,莎士比亞,托爾斯泰,C
「諫太宗十思疏」是誰寫的奏章？,房玄齡,魏徵,杜如晦,B
下列作家何者不是來自俄國？,泰戈爾,普希金,高爾基,A
「如果冬天來了，春天還會遠嗎？」出於哪位作家？,雨果,拜倫,雪萊,C
下列何者不是盧梭的作品？,懺悔錄,紅與黑,社會契約論,B
唐吉訶德是哪個國家的作品？,西班牙,義大利,葡萄牙,A
莎士比亞作品中哪部不是悲劇？,馬克白,李爾王,威尼斯商人,C
下列何者不是托爾斯泰的作品？,戰爭與和平,套中人,復活,B
「老人與海」是在哪一年獲得諾貝爾文學獎的？,1950,1952,1954,C
「福爾摩斯」系列是誰的作品？,柯南道爾,莫里士盧布朗,哈代,A
「東山再起」是誰的典故？,劉備,謝安,孔子,B
「知識就是力量」是何人的名言？,居禮夫人,培根,牛頓,A
被譽為「短篇小說之王」的作家是？,左拉,雨果,莫泊桑,C
下列哪部是日本作品？,源氏物語,天方夜譚,春香傳,A
下列何者不是歌德的作品？,少年維特的煩惱,戰爭與和平,親和力,B
下列何者屬於樂府詩？,孔雀東南飛,聲聲慢,關雎,A
下列何者不是詞牌名？,滿江紅,蝶戀花,麗人行,C
「每逢佳節倍思親」中的「佳節」是甚麼節日？,元宵節,中秋節,重陽節,C
下列詩人中不屬於田園派的是？,岑參,王維,孟浩然,A
下列詩人中不屬於邊塞派的是？,高適,白居易,王昌齡,B
被蘇軾評為「詩中有畫，畫中有詩」的詩人是？,李白,王維,孟浩然,B
「天若有情天亦老」是出於哪位詩人？,韓愈,李白,李賀,C
下列文人中不屬於婉約派的是？,辛棄疾,李清照,柳永,A
四大名亭中的愛晚亭是以誰的詩命名？,李白,杜甫,杜牧,C
「一江春水向東流」是出於哪位詞人？,蘇軾,李煜,李清照,B
李清照如夢令裡的「綠肥紅瘦」是形容甚麼時候的情景？,晚春,盛夏,初秋,A
「民間疾苦，筆底波瀾；世上瘡痍，詩中聖哲」是在形容？,杜甫,白居易,屈原,A
「無邊落木蕭蕭下，不盡長江滾滾來」出於哪首作品？,春望,登高,秋興,B
下列何者不是白樸的雜劇作品？,西廂記,東牆記,牆頭馬上,A
詩經中的「風」是指哪類作品？,民歌,宮廷御樂,祭祀樂歌,Ａ
詩經中的「興」是指甚麼類的表現手法？,直接敘述,打比方,假托別的事物,Ｃ
下列何者不是杜甫的「三別」之一？,從軍別,無家別,垂老別,Ａ
下列何者不是「初唐四杰」的詩人？,王勃,陳子昂,駱賓王,Ｂ
屈原是戰國末期哪國人？,齊,魏,楚,Ｃ
馬雅可夫斯基獨創甚麼體？,溫柔的新體,階梯詩,英雄對偶體,Ｂ
笑傲江湖中「莫大」屬於甚麼派？,嵩山派,恆山派,衡山派,Ｃ
笑傲江湖中「莫大」將劍藏在甚麼樂器裡？,琵琶,古箏,二胡,Ｃ
金庸小說中下列何者不會「九陰白骨爪」？,梅超風,趙敏,周芷若,Ｂ
倚天屠龍記中張無忌的義父是誰？,白眉鷹王,金毛獅王,青翼蝠王,Ｂ
倚天屠龍記中藏在倚天劍中的是甚麼？,九陰真經,九陽真經,武穆遺書,Ａ
蠟像進駐杜莎夫人蠟像館的武打明星是？,甄子丹,李連杰,王羽,A
下列哪一位音樂家是奧地利人,莫札特,貝多芬,布拉姆斯,B
下列何者屬於單樂章結構？,交響曲,協奏曲,交響詩,C
電影「滿城盡帶黃金甲」是由哪部話劇改編？,雷雨,哈姆雷特,李爾王,A
秦始皇統一後也統一了文字稱為？,隸書,小篆,楷書,B
戲曲的臉譜最早出現在隋唐時期的？,蜀樂,雅樂,燕樂,C
紅樓夢中四大家族的姓氏不包括？,王,史,吳,C
文房四寶不包括？,紙,硯,尺鎮,C
耳環最早的目的是為了？,裝飾,地位象徵,約束行為,C
「青梅竹馬」出於哪一部作品？,長干行,長恨歌,無題,A
陽關大道是指通往哪裡的路？,東海,西域,中原,B
不屬於中國四大佛山的是？,武當山,峨嵋山,九華山,A
「鴻雁傳書」出於哪個歷史故事？,霸王別姬,蘇武牧羊,楚漢相爭,B
下列何者是苗族的傳統樂器？,蘆笙,蕭,笛,A
「耄耋之年」指人幾歲？,60,70,80,C
刺繡中有名的「四大名繡」不包括？,蜀繡,滬繡,湘繡,B
目前主流認為「清明上河圖」是甚麼季節？,春,夏,秋,A
下列何者不屬於「四大聲腔」？,海鹽腔,皮黃腔,崑山腔,B
動畫「你的名字」女主角居住地是以哪裡為原型？,飛驒,岩手,山形,A
名偵探柯南的本名是甚麼？,工藤新一,工藤優作,黑羽快斗,A
動漫死神的男主角叫甚麼名字？,黑崎一護,更木劍八,朽木白哉,A
鋼之煉金術師 FA 的主角叫甚麼名字？,愛德華愛力克,阿爾馮斯愛力克,溫利洛克貝爾,A
神奇寶貝動畫版小智從大木博士那裡得到的是？,傑尼龜,小火龍,皮卡丘,C
死亡筆記本真人版中L是誰演的？,中孝介,松山研一,藤原龍也,B
火影忍者中地達羅最後是誰殺死的？,佐助,卡卡西,自殺,C
海賊王中魯夫一行人一開始的船叫甚麼？,梅莉號,千陽號,莫比迪克號,A
火影忍者中下列誰不是卡卡西的徒弟？,漩渦鳴人,春野櫻,奈良鹿丸,C
數碼寶貝中主角的的數碼寶貝是？,比丘獸,亞古獸,拉達獸,B
名偵探柯南中柯南的女友是？,毛利蘭,佐藤美和子,遠山和葉,A
死亡筆記本中流克最喜歡的食物是？,香蕉,牛奶,蘋果,C
遊戲王中法老王最後召喚誰打敗邪神佐克？,歐貝利斯克,歐西里斯,赫爾阿克帝,C
迷糊餐廳裡男主角的大姊是做甚麼工作的？,律師,作家,服務生,A
下列英雄聯盟角色何者是遠程攻擊？,蓋倫,艾希,拉姆斯,B
英雄聯盟比賽一隊上場有幾人？,4,5,6,B
冰原歷險記中喜德是甚麼動物？,長毛象,黃鼠狼,樹懶,C
電影血鑽石中的那顆鑽石是甚麼顏色？,透明,粉紅,紅色,B
電影志氣的劇情與甚麼運動有關？,拔河,接力,棒球,A
電影我家買了動物園中甚麼動物最後因為太老而安樂死？,獅子,老虎,熊,B
動畫里約大冒險的主角是甚麼鳥？,貓頭鷹,老鷹,鸚鵡,C
漫威中的死侍是以DC中的誰為原型？,喪鐘,毀滅日,達克賽德,A
電影美國隊長3中誰身受重傷？,鋼鐵人,黑豹,戰爭機器,C
電影X戰警系列於哪部將時間線重新洗牌？,天啟,第一戰,未來昔日,C
Micheal Jackson曾經考慮買下漫威因為她希望能出演哪個角色？,美國隊長,蜘蛛人,鋼鐵人,B
綠巨人最原始的顏色是？,綠色,灰色,黑色,B
哪位影視明星的形象在漫威漫畫裡出現過？,布萊德彼特,喬治克隆尼,湯姆克魯斯,C
誰曾撕毀同學漫畫書卻最後扮演漫畫中的某位角色？,克里斯伊凡,小勞勃道尼,亨利卡維爾,B
鋼鐵人的血邊裝甲平時收在哪裡？,肌肉,腦部,骨骼,C
電影雷神索爾3中雷神錘被誰捏碎？,洛基,奧丁,海拉,C
電影環太平洋1中最大的怪獸等級是多少？,4,5,6,B
動畫天外奇蹟主角用甚麼讓房子飛上天？,氣球,風扇,磁鐵,A
宮崎駿動畫風之谷中王蟲生氣時眼睛會變成甚麼顏色？,紅,黑,藍,A
哪部宮崎駿的動畫包含濃厚的環保意識？,神隱少女,紅豬,魔法公主,C
宮崎駿所屬的吉卜力工作室以哪部動畫為Logo,神隱少女,風之谷,龍貓,C
紅樓夢中賈寶玉的父親名叫？,賈政,賈璉,賈赦,A
紅樓夢中誰被選入宮？,元春,惜春,探春,A
紅樓夢中賈寶玉的老婆是誰？,林黛玉,薛寶釵,史湘雲,B
紅樓夢中賈寶玉原來是甚麼？,動物,石頭,植物,B
紅樓夢中賈寶玉在大觀園中住的地方叫甚麼？,怡紅院,蘅蕪院,瀟湘館,A
紅樓夢中林黛玉在大觀園中住的地方叫甚麼？,怡紅院,蘅蕪院,瀟湘館,C
紅樓夢一書以甚麼神話為開頭,盤谷開天闢地,女媧補天,大禹治水,B
紅樓夢中英蓮小時候被拐去賣作丫鬟就是後來的誰？,晴雯,香菱,寶珠,B
紅樓夢中林黛玉祖籍在？,蘇州,揚州,杭州,A
紅樓夢中薛寶釵稱自己身體不好需要服用甚麼？,冷香丸,楓露茶,群芳髓,A
紅樓夢中誰曾試圖調戲王熙鳳結果卻被反折磨最後病死？,賈璉,賈薔,賈瑞,C
李安憑藉哪一部電影獲得奧斯卡最佳導演獎？,色戒,斷背山,臥虎藏龍,B
電影不能說的秘密中主角是透過甚麼穿越時空？,機器,鋼琴,CD,B
電影即刻救援中主角老婆在第幾集死掉？,1,2,3,C
下列何者不是古代所稱「下三濫」？,僕婢,演員,娼妓,A
哈利波特的魔杖是甚麼材質？,冬青木,接骨木,胡桃木,A
哈利波特的魔杖裡中的是甚麼魔法物質？,鳳凰羽毛,獨角獸毛,迷拉頭髮,A
哈利波特系列電影第幾集以後鄧不利多一角換不同人飾演？,2,3,4,A
哈利波特中佛地魔的分靈體不包括甚麼東西？,日記,斗篷,戒指,B
哈利波特中詹姆的朋友哪個不是化獸師？,彼得佩迪魯,天狼星布萊克,雷木思路平,C
哈利波特中維克多喀浪來自哪所學校？,霍格華茲,波巴洞,德姆蘭,C
哈利波特是魁地奇比賽中的甚麼職位？,追蹤手,搜捕手,打擊手,B
哈利波特中下列何者不屬於「鳳凰會」？,石內卜,史拉轟,天狼星,Ｂ
哈利波特第一集中好友榮恩在下真人巫師棋時擔任什麼？,主教,城堡,騎士,Ｃ
下列何者不是哈利波特中代表四個學院的動物？,獾,熊,鷹,Ｂ
暮光之城系列電影主角羅伯派汀森曾參演過哈利波特第幾集？,3,4,5,B
哈利波特中幻形怪在面對哈利波特時會變成什麼？,催狂魔,佛地魔,食死人,Ａ
哈利波特將其中一名兒子以霍格華茲歷任校長命名，其中不包括？,鄧不利多,恩不里居,石內卜,Ｂ
哈利波特中拉動學校馬車的生物是？,鷹馬,獨角獸,騎士墜鬼馬,Ｃ
哈利波特中什麼生物要見識過死亡的人才看得到？,騎士墜鬼馬,鷹馬,催狂魔,Ａ
哈利波特在火盃的考驗中面對的是什麼龍？,匈牙利角尾龍,中國火球龍,挪威背脊龍,Ａ
哈利波特在火盃的考驗一開始傳送到魁地奇世界盃的港口鑰是？,報紙,靴子,足球,Ｂ
爵士鼓配件「雙踏」標準的鼓搥在哪腳？,左腳,兩腳各一個,右腳,Ｃ
哪種吉他是使用尼龍弦？,民謠吉他,古典吉他,電吉他,Ｂ
下列何者不是哈利波特騎過的飛天掃帚？,光輪2000,光輪2001,火閃電,Ｂ
笑傲江湖中令狐沖與師妹共同發明什麼劍法？,沖靈劍法,沖岳劍法,沖群劍法,Ａ
射雕英雄傳鐵掌水上飄是誰？,裘千呎,裘千仞,裘千丈,Ｂ
請問下列團體何者為7個人？,Super Junior ,EXO,BTS,C
金庸第一部武俠小說是哪部？,書劍恩仇錄,碧血劍,白馬嘯西風,Ａ
射雕英雄傳中洪七公將丐幫幫主傳給誰？,郭靖,黃蓉,楊康,Ｂ
射雕英雄傳中黃蓉身披什麼？,鎖子甲,秘銀甲,軟蝟甲,Ｃ
